{
  "$schema": "./_audit-shared.schema.json",
  "schema_version": 1,
  "category_groups": {
    "ads": ["ads", "ads_mediation"],
    "trackers": ["analytics", "attribution", "crash_reporting", "social"],
    "consent": ["consent"]
  },
  "tool_groups": {
    "find-ads": ["ads", "consent"],
    "find-trackers": ["trackers"]
  },
  "section_separator": " — ",
  "legacy_flags": {
    "find-trackers": [
      { "flag": "firebase", "sdk_id": "firebase-analytics", "label": "Firebase", "section_prefix": "Firebase Analytics" },
      { "flag": "adjust", "sdk_id": "adjust", "label": "Adjust", "section_prefix": "Adjust" },
      { "flag": "appsflyer", "sdk_id": "appsflyer", "label": "AppsFlyer", "section_prefix": "AppsFlyer" },
      { "flag": "mixpanel", "sdk_id": "mixpanel", "label": "Mixpanel", "section_prefix": "Mixpanel" },
      { "flag": "amplitude", "sdk_id": "amplitude", "label": "Amplitude", "section_prefix": "Amplitude" },
      { "flag": "braze", "sdk_id": "braze", "label": "Braze", "section_prefix": "Braze" },
      { "flag": "clevertap", "sdk_id": "clevertap", "label": "CleverTap", "section_prefix": "CleverTap" }
    ],
    "find-ads": [
      { "flag": "admob", "sdk_id": "google-admob", "label": "AdMob", "section_prefix": "AdMob" },
      { "flag": "unity", "sdk_id": "unity-ads", "label": "UnityAds", "section_prefix": "Unity Ads" },
      { "flag": "ironsource", "sdk_id": "ironsource", "label": "IronSource", "section_prefix": "IronSource" },
      { "flag": "applovin", "sdk_id": "applovin", "label": "AppLovin", "section_prefix": "AppLovin" },
      { "flag": "facebook", "sdk_id": "meta-audience-network", "label": "MetaAN", "section_prefix": "Meta Audience Network" },
      { "flag": "vungle", "sdk_id": "vungle", "label": "Vungle", "section_prefix": "Vungle" },
      { "flag": "inmobi", "sdk_id": "inmobi", "label": "InMobi", "section_prefix": "InMobi" },
      { "flag": "chartboost", "sdk_id": "chartboost", "label": "Chartboost", "section_prefix": "Chartboost" },
      { "flag": "pangle", "sdk_id": "pangle", "label": "Pangle", "section_prefix": "Pangle" },
      { "flag": "mintegral", "sdk_id": "mintegral", "label": "Mintegral", "section_prefix": "Mintegral" }
    ]
  },
  "role_labels": {
    "init": "Initialization",
    "event": "Event Tracking",
    "identity": "User Identity",
    "consent": "Consent",
    "config": "Configuration",
    "endpoint": "Endpoint Configuration",
    "load": "Ad Loading",
    "show": "Ad Showing",
    "listener": "Listeners & Callbacks",
    "ad_operation": "Ad Operations"
  },
  "format_by_class": [
    ["SAVideoAd", "rewarded"],
    ["MyTargetView", "banner"],
    ["TJPlacement", "-"]
  ],
  "format_by_class_token": [
    ["RewardedInterstitial", "rewarded_interstitial"],
    ["AppOpen", "app_open"],
    ["RewardedVideo", "rewarded"],
    ["RewardVideo", "rewarded"],
    ["OptinVideo", "rewarded"],
    ["EarnedReward", "rewarded"],
    ["Rewarded", "rewarded"],
    ["FullScreenVideo", "interstitial"],
    ["InterstitialVideo", "interstitial"],
    ["Interstitial", "interstitial"],
    ["NativeBanner", "native"],
    ["Native", "native"],
    ["Banner", "banner"],
    ["MaxAdView", "banner"],
    ["AdView", "banner"]
  ],
  "format_by_method_token": [
    ["RewardedInterstitial", "rewarded_interstitial"],
    ["AppOpen", "app_open"],
    ["RewardedVideo", "rewarded"],
    ["Rewarded", "rewarded"],
    ["Interstitial", "interstitial"],
    ["Banner", "banner"],
    ["Native", "native"]
  ],
  "format_none": [
    "com.adcolony.sdk.AdColony#configure",
    "com.adcolony.sdk.AdColony#requestAdView",
    "com.adcolony.sdk.AdColony#setRewardListener",
    "com.amazon.device.ads.AdRegistration#setAppKey",
    "com.amazon.device.ads.AdRegistration#enableLogging",
    "com.amazon.device.ads.AdRegistration#enableTesting",
    "com.amazon.device.ads.AdRegistration#setMRAIDPolicy",
    "com.amazon.device.ads.AdRegistration#setMRAIDSupportedVersions",
    "com.amazon.device.ads.AdRegistration#setAdNetworkInfo",
    "com.amazon.device.ads.DTBAdRequest#loadAd",
    "com.applovin.sdk.AppLovinSdk#initialize",
    "com.applovin.sdk.AppLovinSdk#initializeSdk",
    "com.applovin.sdk.AppLovinSdk#getInstance",
    "com.applovin.sdk.AppLovinPrivacySettings#setHasUserConsent",
    "com.applovin.sdk.AppLovinPrivacySettings#setDoNotSell",
    "com.applovin.sdk.AppLovinPrivacySettings#setIsAgeRestrictedUser",
    "com.appodeal.ads.Appodeal#initialize",
    "com.appodeal.ads.Appodeal#setAutoCache",
    "com.appodeal.ads.Appodeal#show",
    "com.appodeal.ads.Appodeal#cache",
    "com.appodeal.ads.Appodeal#hide",
    "com.appodeal.ads.Appodeal#isLoaded",
    "com.appodeal.ads.Appodeal#canShow",
    "com.appodeal.ads.Appodeal#isInitialized",
    "com.appodeal.ads.Appodeal#isPrecache",
    "com.appodeal.ads.Appodeal#isAutoCacheEnabled",
    "io.bidmachine.BidMachine#initialize",
    "com.chartboost.sdk.Chartboost#startWithAppId",
    "com.fyber.inneractive.sdk.external.InneractiveAdManager#initialize",
    "com.fyber.inneractive.sdk.external.InneractiveAdRequest#load",
    "com.google.android.gms.ads.MobileAds#initialize",
    "com.google.android.gms.ads.AdLoader#loadAd",
    "com.google.android.gms.ads.AdLoader#loadAds",
    "com.google.android.gms.ads.MobileAds#setRequestConfiguration",
    "com.google.android.gms.ads.RequestConfiguration$Builder#setTagForChildDirectedTreatment",
    "com.google.android.gms.ads.RequestConfiguration$Builder#setTagForUnderAgeOfConsent",
    "com.google.android.gms.ads.RequestConfiguration$Builder#setMaxAdContentRating",
    "com.google.android.gms.ads.AdLoader$Builder#<init>",
    "guru.ads.fusion.core.GuruAdsSdk#initialize",
    "guru.ads.fusion.admob.GuruAdMobAdsSdk#initialize",
    "guru.ads.fusion.ironsource.GuruIronSourceAdsSdk#initialize",
    "guru.ads.fusion.max.GuruMaxAdsSdk#initialize",
    "com.hyprmx.android.sdk.core.HyprMX#initialize",
    "com.hyprmx.android.sdk.placement.PlacementImpl#loadAd",
    "com.hyprmx.android.sdk.placement.PlacementImpl#showAd",
    "com.hyprmx.android.sdk.placement.PlacementImpl#isAdAvailable",
    "com.inmobi.sdk.InMobiSdk#init",
    "com.unity3d.ironsourceads.IronSourceAds#init",
    "com.unity3d.ironsourceads.IronSourceAds#setConsent",
    "com.unity3d.ironsourceads.IronSourceAds#setMetaData",
    "com.unity3d.ironsourceads.IronSourceAds#enableDebugMode",
    "com.unity3d.mediation.LevelPlay#init",
    "com.unity3d.mediation.LevelPlay#setConsent",
    "com.unity3d.mediation.LevelPlay#setMetaData",
    "com.unity3d.mediation.LevelPlay#setNetworkData",
    "com.unity3d.mediation.LevelPlay#setAdaptersDebug",
    "com.unity3d.mediation.LevelPlay#setSegment",
    "com.unity3d.mediation.LevelPlay#addImpressionDataListener",
    "com.unity3d.mediation.LevelPlay#setDynamicUserId",
    "com.ironsource.unity.androidbridge.LevelPlayBridge#setConsent",
    "com.ironsource.unity.androidbridge.LevelPlayBridge#setMetaData",
    "com.ironsource.unity.androidbridge.LevelPlayBridge#setNetworkData",
    "com.ironsource.unity.androidbridge.LevelPlayBridge#setSegment",
    "com.ironsource.unity.androidbridge.LevelPlayBridge#setAdaptersDebug",
    "com.ironsource.unity.androidbridge.LevelPlayBridge#validateIntegration",
    "com.ironsource.unity.androidbridge.LevelPlayBridge#launchTestSuite",
    "com.ironsource.unity.androidbridge.LevelPlayBridge#setCCPA",
    "com.ironsource.unity.androidbridge.LevelPlayBridge#setCOPPA",
    "com.ironsource.unity.androidbridge.LevelPlayBridge#setGDPRConsents",
    "com.ironsource.unity.androidbridge.LevelPlayBridge#setPluginData",
    "com.ironsource.unity.androidbridge.LevelPlayBridge#setDynamicUserId",
    "com.ironsource.mediationsdk.IronSource#init",
    "com.ironsource.mediationsdk.IronSource#initISDemandOnly",
    "com.ironsource.mediationsdk.IronSource#setConsent",
    "com.ironsource.mediationsdk.IronSource#setMetaData",
    "com.ironsource.mediationsdk.IronSource#setMediationType",
    "com.ironsource.mediationsdk.IronSource#setAdRevenueData",
    "com.ironsource.mediationsdk.IronSource#setUserId",
    "jp.maio.sdk.android.MaioAds#init",
    "jp.maio.sdk.android.MaioAds#show",
    "jp.maio.sdk.android.MaioAds#canShow",
    "jp.maio.sdk.android.MaioAdsInstance#show",
    "jp.maio.sdk.android.MaioAdsInstance#canShow",
    "com.facebook.ads.AudienceNetworkAds#initialize",
    "com.facebook.ads.AudienceNetworkAds#isInitialized",
    "com.facebook.ads.AudienceNetworkAds#buildInitSettings",
    "com.facebook.ads.AdSettings#setMixedAudience",
    "com.mbridge.msdk.out.MBridgeSDKFactory#getMBridgeSDK",
    "com.mbridge.msdk.MBridgeSDK#init",
    "com.mbridge.msdk.MBridgeSDK#initAsync",
    "com.mbridge.msdk.MBridgeSDK#preload",
    "com.mobilefuse.sdk.MobileFuse#init",
    "com.mobilefuse.sdk.MobileFuse#initSdkServices",
    "com.moloco.sdk.Init#registerAllExtensions",
    "com.my.target.common.MyTargetManager#initSdk",
    "com.ogury.sdk.Ogury#start",
    "io.presage.Presage#start",
    "io.presage.common.PresageSdk#init",
    "io.presage.common.PresageSdk#setMediationName",
    "io.presage.ads.Ads#initialize",
    "com.bytedance.sdk.openadsdk.api.init.PAGSdk#init",
    "com.bytedance.sdk.openadsdk.TTAdSdk#init",
    "com.pubmatic.sdk.openwrap.core.POBBid#invalidate",
    "net.pubnative.lite.sdk.HyBid#initialize",
    "com.rovio.beacon.ads.AdsSdk#load",
    "com.rovio.beacon.ads.AdsSdk#show",
    "com.rovio.beacon.ads.AdsSdk#hide",
    "com.rovio.beacon.ads.AdsSdk#poke",
    "com.rovio.beacon.ads.WebViewAdFactory#preloadWebViewAd",
    "com.rovio.beacon.ads.WebViewAd#loadHtml",
    "com.rovio.beacon.ads.WebViewAd#loadUrl",
    "com.rovio.beacon.ads.WebViewAd#show",
    "com.rovio.beacon.ads.WebViewAd#hide",
    "com.rovio.beacon.ads.WebViewAd#reload",
    "com.rovio.beacon.ads.WebViewAd#destroy",
    "com.rovio.beacon.ads.MRAIDController#open",
    "com.rovio.beacon.ads.MRAIDController#expand",
    "com.rovio.beacon.ads.MRAIDController#playVideo",
    "com.rovio.beacon.ads.MRAIDController#resize",